{
  "$schema": "../schema/module.schema.json",
  "island": "athene",
  "version": "1.0.0",
  "owner": "copilot-team",
  "status": "draft",
  "reviewedAt": "2026-10-30",
  "reviewIntervalDays": 90,
  "id": "athene-anweisungen",
  "order": 1,
  "title": {
    "de": "Copilot auf dich einstellen",
    "en": "Setting Copilot up for you"
  },
  "summary": {
    "de": "Mit eigenen Anweisungen und dem Gedächtnis antwortet Copilot so, wie du es brauchst, ohne dass du es jedes Mal neu sagst.",
    "en": "With custom instructions and memory, Copilot answers the way you need without you repeating it every time."
  },
  "estimatedMinutes": 7,
  "notes": "Neuer Inhalt. Stand Oktober 2026: Anweisungen und gespeicherte Erinnerungen unter Einstellungen > Personalisierung (Microsoft-Support «Customize how Microsoft 365 Copilot responds to you»). Gedächtnis wird laut Message Center bis Ende Oktober 2026 allgemein verfügbar; die IT kann es ausschalten. Ob Basic die Personalisierung hat, ist nicht eindeutig belegt: mit dem Basic-Testkonto prüfen. Menüpfad bewusst mit Suchhinweis, weil sich die App mit der neuen Copilot-App ändert.",
  "blocks": [
    {
      "type": "briefing",
      "id": "anweisungen",
      "title": {
        "de": "Einmal sagen, immer gemeint",
        "en": "Say it once, mean it always"
      },
      "body": {
        "de": "Copilot kann sich merken, wie du arbeitest. Dafür gibt es zwei Dinge:\n- **Eigene Anweisungen:** Ein kurzer Text, der für alle deine Chats gilt. Zum Beispiel deine Rolle, die Schweizer Schreibweise oder wie lang Antworten sein sollen.\n- **Gedächtnis:** Copilot merkt sich wichtige Dinge aus euren Gesprächen. Du kannst ihm auch direkt sagen: «Merk dir, dass …».\n\nSo findest du die Einstellungen:\n- Öffne Copilot und klicke auf die **drei Punkte** oder dein **Profilbild**.\n- Wähle **Einstellungen** und dann **Personalisierung**.\n- Sieht es bei dir anders aus? Such in den Einstellungen nach «Personalisierung». Microsoft baut die Copilot-App gerade um.\n\nDu siehst dort jederzeit, was Copilot sich gemerkt hat, und kannst einzelne Erinnerungen löschen.",
        "en": "Copilot can remember how you work. There are two things for this:\n- **Custom instructions:** A short text that applies to all your chats. For example your role, Swiss spelling or how long answers should be.\n- **Memory:** Copilot remembers important things from your conversations. You can also tell it directly: “Remember that …”.\n\nHow to find the settings:\n- Open Copilot and click the **three dots** or your **profile picture**.\n- Choose **Settings** and then **Personalization**.\n- Looks different for you? Search the settings for “Personalization”. Microsoft is currently rebuilding the Copilot app.\n\nThere you can always see what Copilot has remembered and delete individual memories."
      }
    },
    {
      "type": "quiz",
      "id": "q-anweisungen-inhalt",
      "difficulty": "intermediate",
      "question": {
        "de": "Was gehört in deine eigenen Anweisungen?",
        "en": "What belongs in your custom instructions?"
      },
      "options": [
        {
          "id": "a",
          "text": {
            "de": "Deine Rolle, zum Beispiel «Ich arbeite im Produktmanagement Fernreisen.»",
            "en": "Your role, for example “I work in long-haul product management.”"
          },
          "correct": true,
          "explanation": {
            "de": "Ja. Die Rolle hilft in fast jedem Chat.",
            "en": "Yes. The role helps in almost every chat."
          }
        },
        {
          "id": "b",
          "text": {
            "de": "Wie du Antworten willst: kurz, gegliedert, Schweizer Rechtschreibung",
            "en": "How you want answers: short, structured, Swiss spelling"
          },
          "correct": true,
          "explanation": {
            "de": "Ja. Das musst du dann nicht mehr jedes Mal schreiben.",
            "en": "Yes. Then you no longer have to write it every time."
          }
        },
        {
          "id": "c",
          "text": {
            "de": "Die Buchungsnummer eines Kunden, den du gerade betreust",
            "en": "The booking number of a customer you are currently looking after"
          },
          "correct": false,
          "explanation": {
            "de": "Kundendaten gehören nie in die Anweisungen. Sie würden in jedem Chat mitgeschickt.",
            "en": "Customer data never belongs in the instructions. It would be sent with every chat."
          }
        },
        {
          "id": "d",
          "text": {
            "de": "Die genaue Aufgabe von heute Nachmittag",
            "en": "The exact task for this afternoon"
          },
          "correct": false,
          "explanation": {
            "de": "Eine einzelne Aufgabe gehört in den Chat. Anweisungen gelten dauerhaft.",
            "en": "A single task belongs in the chat. Instructions apply permanently."
          }
        }
      ]
    },
    {
      "type": "quiz",
      "id": "q-gedaechtnis",
      "difficulty": "intermediate",
      "question": {
        "de": "Copilot hat sich gemerkt, dass du im Marketing arbeitest. Du bist aber im Produktmanagement. Was hilft?",
        "en": "Copilot has remembered that you work in marketing. But you are in product management. What helps?"
      },
      "options": [
        {
          "id": "a",
          "text": {
            "de": "Einen neuen Chat beginnen, dann ist die Erinnerung weg",
            "en": "Start a new chat, then the memory is gone"
          },
          "correct": false,
          "explanation": {
            "de": "Das Gedächtnis gilt über alle Chats. Ein neuer Chat ändert daran nichts.",
            "en": "Memory applies across all chats. A new chat changes nothing."
          }
        },
        {
          "id": "b",
          "text": {
            "de": "Die Erinnerung unter Personalisierung löschen oder Copilot sagen: «Vergiss, dass …»",
            "en": "Delete the memory under Personalization or tell Copilot: “Forget that …”"
          },
          "correct": true,
          "explanation": {
            "de": "Richtig. Du behältst die Kontrolle über das, was Copilot sich merkt.",
            "en": "Right. You stay in control of what Copilot remembers."
          }
        },
        {
          "id": "c",
          "text": {
            "de": "Den Browser-Verlauf löschen",
            "en": "Clear the browser history"
          },
          "correct": false,
          "explanation": {
            "de": "Die Erinnerungen liegen in deinem Microsoft-365-Konto, nicht im Browser.",
            "en": "The memories are stored in your Microsoft 365 account, not in the browser."
          }
        },
        {
          "id": "d",
          "text": {
            "de": "Die IT bitten, dein Copilot-Konto zurückzusetzen",
            "en": "Ask IT to reset your Copilot account"
          },
          "correct": false,
          "explanation": {
            "de": "Das ist nicht nötig. Du kannst Erinnerungen selbst ansehen und löschen.",
            "en": "That is not necessary. You can view and delete memories yourself."
          }
        }
      ]
    },
    {
      "type": "mission",
      "id": "m-anweisungen",
      "title": {
        "de": "Deine Anweisungen",
        "en": "Your instructions"
      },
      "task": {
        "de": "Öffne in Copilot die Einstellungen und dort die Personalisierung. Füge den Text unten als eigene Anweisungen ein und passe die Klammern an. Stell danach in einem neuen Chat eine Frage und schau, ob die Antwort jetzt besser passt.",
        "en": "In Copilot, open the settings and then Personalization. Paste the text below as custom instructions and adjust the brackets. Then ask a question in a new chat and see whether the answer fits better now."
      },
      "tip": {
        "de": "Findest du keine Personalisierung? Dann ist sie bei euch noch nicht verfügbar oder von der IT ausgeschaltet. Du kannst den Text auch an den Anfang eines Chats stellen.",
        "en": "Can't find Personalization? Then it is not available for you yet or IT has turned it off. You can also put the text at the start of a chat."
      },
      "copyText": {
        "de": "Ich arbeite bei DERTOUR Suisse im Bereich [dein Bereich]. Schreib auf Deutsch in Schweizer Rechtschreibung (immer «ss», nie das Eszett). Antworte kurz und gegliedert, mit Aufzählungen, wenn es passt. Frag nach, wenn dir etwas fehlt.",
        "en": "I work at DERTOUR Suisse in [your area]. Write in English and keep it short and structured, with bullet points where it fits. Ask if anything is missing."
      }
    },
    {
      "type": "usecase",
      "id": "u-anweisungen",
      "intro": {
        "de": "Was erklärst du Copilot immer wieder? Halte die Aufgabe fest, bei der dir feste Anweisungen am meisten Zeit sparen.",
        "en": "What do you keep explaining to Copilot? Record the task where fixed instructions save you the most time."
      }
    }
  ]
}
